{
  "schema_version": "2026-04-28.evidence-bundle.v0.1",
  "artifact_type": "evidence_bundle",
  "proof_mode": "dry_run_contract_proof",
  "status": "dry_run_contract_proof",
  "met": true,
  "gap": "live_target_evidence_not_collected_by_design",
  "evidence_items": 6,
  "criteria": [
    {
      "id": "demo_runtime_mode",
      "claim": "Demo bundle was generated in demo mode.",
      "source": "run_pipeline.demo.json",
      "status": "met",
      "observed": "demo"
    },
    {
      "id": "policy_decision_recorded",
      "claim": "Policy gate decision was captured as a contract artifact.",
      "source": "policy_decision.json",
      "status": "met",
      "observed": "demo_scope_target_override"
    },
    {
      "id": "prepared_spec_redacted",
      "claim": "Prepared execution spec can be redacted for public/auditor review.",
      "source": "prepared_execution_spec.redacted.json",
      "status": "met"
    },
    {
      "id": "approved_spec_recorded",
      "claim": "Approved execution spec was produced before executor handoff.",
      "source": "approved_execution_spec.json",
      "status": "met",
      "observed": "2026-03-18.approved.v1"
    },
    {
      "id": "dry_run_receipt_recorded",
      "claim": "Execution receipt records dry-run/mock execution instead of live offensive execution.",
      "source": "execution_receipt.json",
      "status": "met",
      "observed": "dry-run"
    },
    {
      "id": "public_safe_target",
      "claim": "Public demo target remains example.com/local-safe.",
      "source": "approved_execution_spec.json",
      "status": "met",
      "observed": "example.com"
    }
  ],
  "non_claims": [
    "does_not_claim_live_vulnerability_evidence",
    "does_not_execute_against_live_private_targets",
    "does_not_include_raw_stdout_stderr_or_private_paths"
  ],
  "source_artifacts": {
    "policy_decision": "policy_decision.json",
    "prepared_execution_spec": "prepared_execution_spec.redacted.json",
    "approved_execution_spec": "approved_execution_spec.json",
    "execution_receipt": "execution_receipt.json",
    "evidence_summary": "evidence_summary.md"
  },
  "public_safety": {
    "runtime_mode": "demo",
    "target_host": "example.com",
    "dry_run": true,
    "raw_live_evidence_included": false,
    "raw_stdout_stderr_included": false
  }
}
